{
	"$schema": "../../schemas/tokens.schema.json",
	"color": {
		"background": "light-dark(#f6f2ec, #15120e)",
		"surface": {
			"default": "light-dark(#fffdfa, #1d1915)",
			"subtle": "light-dark(#f1ece3, #26211a)",
			"strong": "light-dark(#e7e0d4, #322b22)"
		},
		"text": {
			"default": "light-dark(#23201b, #f0e9dd)",
			"secondary": "light-dark(#5d564c, #b4a996)",
			"muted": "light-dark(#8e867a, #877c6c)"
		},
		"accent": {
			"default": "light-dark(#17595e, #72bec2)",
			"hover": "light-dark(#124a4e, #8bcccf)",
			"text": "light-dark(#fffdfa, #15120e)",
			"subtle": "light-dark(#e2eded, #113032)",
			"border": "light-dark(#b6d3d5, #1d4a4d)"
		},
		"success": {
			"default": "light-dark(#4c6d2c, #9cc16b)",
			"subtle": "light-dark(#edf1e2, #1c2413)",
			"indicator": "light-dark(#6f9b45, #84ad55)"
		},
		"warning": {
			"default": "light-dark(#8a5a14, #dcae63)",
			"subtle": "light-dark(#f8eeda, #2c2314)",
			"indicator": "light-dark(#c58a2a, #c79646)"
		},
		"danger": {
			"default": "light-dark(#9c3327, #e8897b)",
			"subtle": "light-dark(#f8e7e2, #2f1a16)",
			"indicator": "light-dark(#c2503f, #cf6a5c)"
		}
	},
	"border": {
		"color": {
			"default": "light-dark(#e5ded2, #302a21)",
			"strong": "light-dark(#cdc3b3, #463e31)"
		},
		"radius": {
			"small": "8px",
			"medium": "12px",
			"large": "20px"
		}
	},
	"boxShadow": {
		"color": "light-dark(rgb(60 48 32 / 9%), rgb(0 0 0 / 50%))"
	},
	"typography": {
		"fontFamily": {
			"ui": [
				"Karla",
				"ui-sans-serif",
				"system-ui",
				"-apple-system",
				"Segoe UI",
				"sans-serif"
			],
			"display": [
				"Newsreader",
				"ui-serif",
				"Georgia",
				"Times New Roman",
				"serif"
			],
			"title": [
				"Newsreader",
				"ui-serif",
				"Georgia",
				"Times New Roman",
				"serif"
			]
		},
		"fontFace": [
			{
				"fontFamily": "Karla",
				"src": "fonts/karla-latin-wght-normal.woff2",
				"fontWeight": "200 800",
				"unicodeRange": "U+0000-00FF, U+0131, U+0152-0153, U+02BB-02BC, U+02C6, U+02DA, U+02DC, U+0304, U+0308, U+0329, U+2000-206F, U+20AC, U+2122, U+2191, U+2193, U+2212, U+2215, U+FEFF, U+FFFD"
			},
			{
				"fontFamily": "Karla",
				"src": "fonts/karla-latin-ext-wght-normal.woff2",
				"fontWeight": "200 800",
				"unicodeRange": "U+0100-02BA, U+02BD-02C5, U+02C7-02CC, U+02CE-02D7, U+02DD-02FF, U+0304, U+0308, U+0329, U+1D00-1DBF, U+1E00-1E9F, U+1EF2-1EFF, U+2020, U+20A0-20AB, U+20AD-20C0, U+2113, U+2C60-2C7F, U+A720-A7FF"
			},
			{
				"fontFamily": "Newsreader",
				"src": "fonts/newsreader-latin-opsz-normal.woff2",
				"fontWeight": "200 800",
				"unicodeRange": "U+0000-00FF, U+0131, U+0152-0153, U+02BB-02BC, U+02C6, U+02DA, U+02DC, U+0304, U+0308, U+0329, U+2000-206F, U+20AC, U+2122, U+2191, U+2193, U+2212, U+2215, U+FEFF, U+FFFD"
			},
			{
				"fontFamily": "Newsreader",
				"src": "fonts/newsreader-latin-ext-opsz-normal.woff2",
				"fontWeight": "200 800",
				"unicodeRange": "U+0100-02BA, U+02BD-02C5, U+02C7-02CC, U+02CE-02D7, U+02DD-02FF, U+0304, U+0308, U+0329, U+1D00-1DBF, U+1E00-1E9F, U+1EF2-1EFF, U+2020, U+20A0-20AB, U+20AD-20C0, U+2113, U+2C60-2C7F, U+A720-A7FF"
			}
		],
		"fontSize": {
			"base": "13.5px",
			"pageTitle": "32px",
			"entryTitle": "15.5px",
			"stat": "34px"
		},
		"letterSpacing": {
			"pageTitle": "-.014em",
			"entryTitle": "0"
		}
	},
	"padding": {
		"row": "16px",
		"panel": "19px",
		"inline": "26px"
	}
}
